Contratto Collettivo di Lavoro dei Laboratori di Protesi Dentaria 2014 - 2004,contratto-collettivo-di-lavoro-dei-laboratori-di-protesi-dentaria-2014,Switzerland,fr,2004
Contratto Collettivo di Lavoro per il ramo dei Servizi di Sicurezza Privati 2014 - 2014,contratto-collettivo-di-lavoro-per-il-ramo-dei-servizi-di-sicurezza-privati-2014,Switzerland,fr,2014
Contratto Collettivo di Lavoro per il Settore del Prestito di Personale 2011 - 2012,contratto-collettivo-di-lavoro-per-il-settore-del-pestito-di-personale-2011,Switzerland,fr,2012
Contratto Collettivo di Lavoro per il Settore dell’ Infrastruttura di Rete 2018 - 2018,contratto-collettivo-di-lavoro-per-il-settore-dell-infrastruttura-di-rete-2018,Switzerland,fr,2018
Contratto Collettivo di Lavoro per l'Iindustria Svizzera dei Mobili 2013 - 2013,contratto-collettivo-di-lavoro-per-l-iindustria-svizzera-dei-mobili-2013,Switzerland,fr,2013
Contratto Collettivo di Lavoro per le Costruzioni Ferroviarie - 2000,collective-bargaining-agreement-for-railway-construction-1998,Switzerland,fr,2000
Contratto Collettivo di Lavoro per la Posa di Ponteggi 2013 - 2013,contratto-collettivo-di-lavoro-per-la-posa-di-ponteggi-2013,Switzerland,fr,2013
Contratto Collettivo Nazionale di Lavoro dell’Industria Alberghiera e della Ristorazione 1998 - 1999,contratto-collettivo-nazionale-di-lavoro-dell-industria-alberghiera-e-della-ristorazione-1998,Switzerland,fr,1999
Contratto Collettivo Nazionale per la Professione di Parrucchiere 2010 - 2010,contratto-collettivo-nazionale-per-la-professione-di-parrucchiere-2010,Switzerland,fr,2010
Contratto collettivo di lavoro per il settore dei contact center e call center 2018 - 2018,contratto-collettivo-di-lavoro-per-il-settore-dei-contact-center-e-call-center-2018,Switzerland,fr,2018
Contratto collettivo di lavoro per l’industria svizzera dei prodotti in calcestruzzo 2003 - 2003,contratto-collettivo-di-lavoro-per-l-industria-svizzera-dei-prodotti-in-calcestruzzo-2003,Switzerland,fr,2003
Contratto collettivo di lavoro per il settore della panetteria-pasticceria-confetteria artigianale svizzera concluso il 7 ottobre 2014 - 2014,contratto-collettivo-di-lavoro-per-il-settore-della-panetteria-pasticceria-confetteria-artigianale-svizzera-concluso-il-7-ottobre-2014,Switzerland,fr,2014
"European Appendix to ABB Group Social Policy, 2009 - 2009",european-appendix-to-abb-group-social-policy-2009,Switzerland,en,2009
LSO CGM GROUP - 2004,recognition-and-procedural-agreement-between-cgm-group-and-factory-workers-union-fawu---2004,Lesotho,en,2004
LSO ACE Apparel [PTY] LTD - 2009,collective-bargaining-agreement-between-ace-apparel-pty-ltd-and-factory-workers-union-fawu---2009,Lesotho,en,2009
LSO CBI Low Voltage - Lesotho - 2008,recognition-and-procedural-agreement-between-cbi-low-voltage---lesotho-and-factory-workers-union-fawu-,Lesotho,en,2008
LSO Tern Sportswear [PTY] LTD - 2011,recognition-and-procedural-agreement-between-tern-sportswear-pty-ltd-and-factory-workers-union-fawu-,Lesotho,en,2011
"LSO Nien Hsing International [PTY] LTD, LSO C&Y Garments - 2006",memorandum-of-understanding-between-nien-hsing-international-pty-ltd-and-c-y-garments-and-factory-workers-union-fawu-,Lesotho,en,2006
"ISS - UNI GLOBAL AGREEMENT, 2008 - 2008",iss---uni-global-agreement-2008,Denmark,en,2008
Aftale mellem KL og Forhandlingsfællesskabet om overenskomst- og aftalefornyelsen pr. 1 april 2018 - 2018,aftale-mellem-kl-og-forhandlingsf-llesskabet-om-overenskomst--og-aftalefornyelsen-pr-1-april-2018,Denmark,da,2018
Danish public sector industrial relations and welfare services in times of trouble -,danish-public-sector-industrial-relations-and-welfare-services-in-times-of-trouble,Denmark,da,
Lederaftalen 3. udgave (kommenteret) - 2007 - 2007,lederaftalen-3-udgave-kommenteret---2007,Denmark,da,2007
RESULTATET AF FORHANDLINGERNE MELLEM MINISTEREN FOR OFFENTLIG INNOVATION OG CENTRALORGANISATIONERNES FÆLLESUDVALG - 2018 - 2018,resultatet-af-forhandlingerne-mellem-ministeren-for-offentlig-innovation-og-centralorganisationernes-f-llesudvalg---2018,Denmark,da,2018
FORMANDSOVERENSKOMSTEN MELLEM: DANSK BYGGERI OG DANSK FORMANDS FORENING - 2017 - 2017,formandsoverenskomsten-mellem-dansk-byggeri-og-dansk-formands-forening---2017,Denmark,da,2017
Overenskomst mellem HK HANDEL og Coop Danmark A/S - 2017 - 2017,overenskomst-mellem-hk-handel-og-coop-danmark-a-s---2017,Denmark,da,2017
DNK Hilfr ApS. - 2018,collective-agreement-between-hilfr-aps-and-3f-private-service-hotel-and-restaurant-2018---2019,Denmark,en,2018
DNK TEKNIQ - 2014,vvs-overenskomsterne_2014-2017,Denmark,da,2014
DNK Employers Employers Association - 2014,f-devareoverenskomst-f-devareforbundet-nnf_brugsforeningernes-arbejdsgiverforening,Denmark,da,2014
Brugsforeningen for Als og Sundeved DNK Large Stores Negotiating Committee - 2014,overenskomst-storbutikkernes-forhandlingsudvalg_3f_2014-2017,Denmark,da,2014
"DNK Independent Users Country Club, DNK Employers Employers Association - 2014",overenskomst-ba_sbl_hk,Denmark,da,2014
"DNK Independent Users Country Club, DNK Large Stores Negotiating Committee - 2014",overenskomst-sfu_sbl_hk_2014-2017,Denmark,da,2014
Dansk Erhverv Arbejdsgiver-HK Privat-HK Handel_2014-2017,cba_dansk-erhverv-arbejdsgiver-hk-privat-hk-handel_2014-2017,Denmark,da,2014
DNK Danish Business Employer - 2014,cba_dansk-erhverv-arbejdsgiver-hk-handel_2014-2017,Denmark,da,2014
"FTEHIM KOLLETTIV BEJN SIMONDS FARSONS CISK PLC IT-TAQSIMA LUKANDI, IKEL U XORB TAL-UNION ĦADDIEMA MAGĦQUDIN ĦADDIEMA KLERIKALI 2014 - 2018 - 2014",ftehim-kollettiv-bejn-simonds-farsons-cisk-plc-it-taqsima-lukandi-ikel-u-xorb-tal-union-addiema-mag-qudin-addiema-klerikali-2014---2018,Malta,mt,2014
Ftehim Kollettiv bejn Simonds Farsons Cisk plc u t-Taqsima Ospitalità u ikel tal-General Workers' Union 01.01.2014 - 31.12.2018 - 2014,ftehim-kollettiv-bejn-simonds-farsons-cisk-plc-u-t-taqsima-ospitalit-u-ikel-tal-general-workers-union-01-01-2014---31-12-2018,Malta,mt,2014
"Ftehim Kollettiv bejn Quintano Foods Ltd. u it- Taqsima Ospitalità u Ikel tal-General Workers Union, 2017 – 2019. - 2017",ftehim-kollettiv-bejn-quintano-foods-ltd-u-it--taqsima-ospitalit-u-ikel-tal-general-workers-union-2017-2019-,Malta,mt,2017
Collective Agreement for Employees in the Public Service - 2011 - 2011,collective-agreement-for-employees-in-the-public-service---2011,Malta,en,2011
KV_vida-WKÖ_2020 - 2020,kv_vida-wk-_2020,Austria,de,2020
AUT Austrian Federal Economic Chamber - Trade Division - 2016,kv-angestellte-in-pharmazeutischen-gro-handel-at-2016,Austria,de,2016
AUT Austrian Federal Economic Chamber - Trade Division - 2016,kv-angestellte-und-lehrlinge-in-handelsbetrieb-at-2016,Austria,de,2016
garagen-tankstellen-servicestationsunternehmugen Vida-2016,kv_garagen-tankstellen-servicestationsunternehmugen-vida-2016,Austria,de,2016
KV für die Angestellten des Versandhandels - 2016,kollektivvertrag-telefonische-kundenberatung-im-versandhandel-2016,Austria,de,2016
AUT Federal Council of Tabaktrafikanten of the Austrian Federal Economic Chamber - 2016,kollektivvertrag-f-r-die-angestellten-in-tabaktrafiken-2016,Austria,de,2016
SVN Association of Employers of Slovenia -,kolektivno-pogodbo-dejavnosti-trgovine-slovenije,Slovenia,sl,
"LTU Statoil Fuel & Retail Lietuva, Uab (Statoil Fuel & Retail Lithuania, Ltd.) - 2014",statoil-fuel-retail-lietuva-uab-kolektyvin-sutartis-susitarimas-d-l-statoil-fuel-retail-lietuva-uab-kolektyvin-s-sutarties-pakeitimo_2014,Lithuania,lt,2014
SWE H&M - 2015,global-framework-agreement-on-compliance-and-implementation-of-international-labour-standards-at-the-suppliers-of-h-m-2015,Sweden,en,2015
Framework agreement between Skanska and IFBWW 2001 - 2001,framework-agreement-between-skanska-and-ifbww-2001,Sweden,en,2001
SWE IKEA - 2001,framework-agreement-between-ikea-and-the-ifbww-2001,Sweden,en,2001
Kompetensföretagen f.d. Bemanningsföretagen - 2017 - 2017,kompetensf-retagen-f-d-bemanningsf-retagen---2017,Sweden,sv,2017
Medieföretagen fd SIF-MIA - 2017 - 2017,medief-retagen-fd-sif-mia---2017,Sweden,sv,2017
Handelns Tjänstemannaavtal - 2017 - 2017,handelns-tj-nstemannaavtal---2017,Sweden,sv,2017
Sveriges Byggindustrier - 2017 - 2017,sveriges-byggindustrier---2017,Sweden,sv,2017
Industriarbetsgivarna Stål- och Metallindustrin - 2017 - 2017,industriarbetsgivarna-st-l--och-metallindustrin---2017,Sweden,sv,2017
Trä- och Möbelföretagen Stoppmöbelindustrin - 2017 - 2017,tr---och-m-belf-retagen-stoppm-belindustrin---2017,Sweden,sv,2017
Svensk Handel Systembolaget: 2017 – 2020 - 2017,svensk-handel-systembolaget-2017-2020,Sweden,sv,2017
SWE Svensk Handel - 2017,kollektivavtal-mellan-ena-sidan-svensk-handel-och-andra-sidan-handelsanst-lldas-f-rbund-avseende-lager-och-e-handel,Sweden,sv,2017
SWE Svensk Handel - 2017,avtal-mellan-svensk-handel-och-handelsanst-lldas-f-rbund-1-april-2017-31-december-2019,Sweden,sv,2017
SWE Svensk Handel - 2017,avtal-mellan-svensk-handel-och-handelsanst-lldas-f-rbund-detaljhandel---1-april-2017-31-mars-2020,Sweden,sv,2017
Unionen_Svensk Handel_Tjänstemän inom detaljhandeln_2016-2017_avtalstryck - 2016,unionen_svensk-handel_tja-nstema-n-inom-detaljhandeln_2016-2017_avtalstryck,Sweden,sv,2016
Tjänstemannavtal 265_avtalstryck_2016-2017_SvenskHandel_Unionen - 2016,tja-nstemannavtal-265_avtalstryck_2016-2017_svenskhandel_unionen,Sweden,sv,2016
KOLLEKTIVAVTAL mellan a ena sidan svensk handel och a andra sidan HANDELSANSTALLDAS FORBUND avseende NO 2016-17,kollektivavtal-mellan-a-ena-sidan-svensk-handel-och-a-andra-sidan-handelsanstalldas-forbund-avseende-no-2016-17,Sweden,sv,2016
KOLLEKTIVAVTAL mellan a ena sidan SVENSK HANDEL och a andra sidan HANDELSANSTALLDAS FORBUND avseende lagerpersonaloch chaufforer inom partihandeln,kollektivavtal-mellan-a-ena-sidan-svensk-handel-och-a-andra-sidan-handelsanstalldas-forbund-avseende-lagerpersonaloch-chaufforer-inom-partihandeln-2016-17,Sweden,sv,2016
KOLLEKTIVAVTAL mellan a ena sidan SVENSK HANDEL och a andra sidan HANDELSANSTÄLLDAS FÖRBUND avseende lagerpersonal vid postorder och e-handelsföretag 2016-17,kollektivavtal-mellan-a-ena-sidan-svensk-handel-och-a-andra-sidan-handelsanst-lldas-f-rbund-avseende-lagerpersonal-vid-postorder-och-e-handelsf-retag-2016-17,Sweden,sv,2016
TUR Türkiye Elektrik Dağıtım Anonim Şirketi (TEDAŞ) - 2017,teda-t-rk-ye-elektr-k-da-itim-a-genel-m-d-rl-ve-ba-li-yerler-n-ba-itlanan---2017,Turkey,tr,2017
GRUP TOPLU IŞ SÖZLEŞMESİ - 2018 - 2018,grup-toplu-i-s-zle-mes---2018,Turkey,tr,2018
TUR İLLER BANKASI A.Ş. - 2017,tes--t-rk-ye-enerj-su-ve-gaz-ler-send-kasi-le-kamu--kamu-letmeler-verenler-send-kasi-arasinda-ller-bankasi-a---2017,Turkey,tr,2017
TUR DHL LOJİSTİK HİZMETLERİ A.Ş - 2018,dhl-loj-st-k-h-zmetler-a-le-t-mt-s-t-m-ta-ima-ler-send-kasi---2018,Turkey,tr,2018
TUR MS İSTANBUL İÇ VE DIŞ TİCARET LTD - 2016,ms-stanbul-ve-di-t-caret-l-m-ted-rket-ve-ba-li-yerler-letme-toplu-s-zle-mes---2016,Turkey,tr,2016
TUR METRO GROSMARKET BAKIRKÖY ALIŞVERİŞ HİZMETLERİ TİC. LTD. - 2019,metro-grosmarket-bakirk-y-ali-ver-h-zmetler-t-c-ltd-t-le-sosyal--send-kasi-arasinda-ba-itlanan---2019,Turkey,tr,2019
TUR LUFTHANSA ÇAĞRI MERKEZİ VE MÜŞTERİ HİZMETLERİ - 2018,lufthansa-a-ri-merkez-ve-m-ter-h-zmetler-t-c-a-le-sosyal--send-kasiarasinda-ba-itlanan---2018,Turkey,tr,2018
TUR İZFAŞ İZMİR FUARCILIK HİZMETLERİ KÜLTÜR VE SANAT İŞLERİ TİCARET ANONİM ŞİRKETİ İLE SOSYAL - 2018,-zfa-zm-r-fuarcilik-h-zmetler-k-lt-r-ve-sanat-ler-t-caret-anon-m-rket-le-sosyal-t-rk-ye-sosyal-s-gortalar-e-t-m-b-ro-t-caret-kooperat-f-ve-g-zel-sanatlar-ler-send-kasi-arasinda-ba-itlanan,Turkey,tr,2018
TUR ULUSLARARASI AF ÖRGÜTÜ TÜRKİYE - 2019,uluslararasi-af-rg-t-t-rk-ye-ubes-le-sosyal--send-kasi-arasinda-ba-itlanan-01-01-2019-31-12-2021-y-r-rl-k-s-rel-toplu-s-zle-mes-,Turkey,tr,2019
TUR UPS HIZLI KARGO TAŞIMACILIĞI A.Ş. - 2019,-ups---ups-hizli-kargo-ta-imacili-i-a-le-t-mt-s---t-m-ta-ima-ler-send-kasi-arasinda-yapilan-4-d-nem-letme-toplu-s-zle-mes-y-r-rl-k-s-res-,Turkey,tr,2019
TUR HİZMET KOLLARINA YÖNELİK MALİ VE SOSYAL - 2018,kamu-g-revl-ler-n-n-genel-ne-ve-h-zmet-kollarina-y-nel-k-mal-ve-sosyal-haklara-l-k-n-2018-ve-2019-yillarini-kapsayan-4-d-nem-toplu-s-zle-me,Turkey,tr,2018
"TUR ÜNİBEL ÖZEL EĞİTİM BİLGİ TEKNOLOJİLERİ KÜLTÜR, TANITIM VE YAYINCILIK SAN. - 2018",-n-bel-zel-e-t-m-b-lg-teknoloj-ler-k-lt-r-tanitim-ve-yayincilik-san-ve-t-c-a-le-sosyal--send-kasi-arasinda-ba-itlanan---2018,Turkey,tr,2018
DÖRDÜNCÜ BÖLÜM YEREL YÖNETİM HİZMET KOLUNA İLİŞKİN TOPLU SÖZLEŞME -,d-rd-nc-b-l-m-yerel-y-net-m-h-zmet-koluna-l-k-n-toplu-s-zle-me,Turkey,tr,
"BEŞİNCİ BÖLÜM BASIN, YAYIN VE İLETİŞİM HİZMET KOLUNA İLİŞKİN TOPLU SÖZLEŞME -",be-nc-b-l-m-basin-yayin-ve-let-m-h-zmet-koluna-l-k-n-toplu-s-zle-me,Turkey,tr,
ONBİRİNCİ BÖLÜM DİYANET VE VAKIF HİZMET KOLUNA İLİŞKİN TOPLU SÖZLEŞME -,onb-r-nc-b-l-m-d-yanet-ve-vakif-h-zmet-koluna-l-k-n-toplu-s-zle-me,Turkey,tr,
"YEDİNCİ BÖLÜM BAYINDIRLIK, İNŞAAT VE KÖY HİZMET KOLUNA İLİŞKİN TOPLU SÖZLEŞME -",yed-nc-b-l-m-bayindirlik-n-aat-ve-k-y-h-zmet-koluna-l-k-n-toplu-s-zle-me,Turkey,tr,
SEKİZİNCİ BÖLÜM ULAŞTIRMA HİZMET KOLUNA İLİŞKİN TOPLU SÖZLEŞME -,sek-z-nc-b-l-m-ula-tirma-h-zmet-koluna-l-k-n-toplu-s-zle-me,Turkey,tr,
ÜÇÜNCÜ BÖLÜM SAĞLIK VE SOSYAL HİZMET KOLUNA İLİŞKİN TOPLU SÖZLEŞME -,-nc-b-l-m-sa-lik-ve-sosyal-h-zmet-koluna-l-k-n-toplu-s-zle-me,Turkey,tr,
"ONUNCU BÖLÜM ENERJİ, SANAYİ VE MADENCİLİK HİZMET KOLUNA İLİŞKİN TOPLU SÖZLEŞME -",onuncu-b-l-m-enerj-sanay-ve-madenc-l-k-h-zmet-koluna-l-k-n-toplu-s-zle-me,Turkey,tr,
"İKİNCİ BÖLÜM EĞİTİM, ÖĞRETİM VE BİLİM HİZMET KOLUNA İLİŞKİN TOPLU SÖZLEŞME -",-k-nc-b-l-m-e-t-m-ret-m-ve-b-l-m-h-zmet-koluna-l-k-n-toplu-s-zle-me,Turkey,tr,
ALTINCI BÖLÜM KÜLTÜR VE SANAT HİZMET KOLUNA İLİŞKİN TOPLU SÖZLEŞME -,altinci-b-l-m-k-lt-r-ve-sanat-h-zmet-koluna-l-k-n-toplu-s-zle-me,Turkey,tr,
TUR British Council Eğitim Hizmetleri Limited - 2019,british-council-e-t-m-h-zmetler-l-m-ted-rket-letme-toplu-s-zle-mes---2019,Turkey,tr,2019
ARAS KARGO YURT İÇİ YURT DIŞI TAŞIMACILIK A.Ş. TÜM TAŞIMA İŞÇİLERİ SENDİKASI (TÜMTİS) TOPLU İŞ SÖZLEŞMESİ - 2018 - 2018,aras-kargo-yurt-yurt-di-i-ta-imacilik-a-t-m-ta-ima-ler-send-kasi-t-mt-s-toplu-s-zle-mes---2018,Turkey,tr,2018
DOKUZUNCU BÖLÜM TARIM VE ORMANCILIK HİZMET KOLUNA İLİŞKİN TOPLU SÖZLEŞME -,dokuzuncu-b-l-m-tarim-ve-ormancilik-h-zmet-koluna-l-k-n-toplu-s-zle-me,Turkey,tr,
PUBLIC SERVICE STABILITY AGREEMENT - 2018 – 2020 - 2018,public-service-stability-agreement---2018-2020,Ireland,en,2018
"Enel Global Framework Agreement, Roma, 14 giugno 2013 - 2013",enel-global-framework-agreement-roma-14-giugno-2013,Italy,it,2013
"ACCORDO QUADRO GLOBALE SULLE RELAZIONI INDUSTRIALI A LIVELLO INTERNAZIONALE E SULLA RESPONSABILITÀ SOCIALE DELL'IMPRESA di ENI S.p.A, 2019 - 2019",accordo-quadro-globale-sulle-relazioni-industriali-a-livello-internazionale-e-sulla-responsabilit-sociale-dell-impresa-di-eni-s-p-a-2019,Italy,it,2019
ccnl per i dipendenti da aziende del terziario della distribuzione e dei servizi 2019 - 2015,ccnl-per-i-dipendenti-da-aziende-del-terziario-della-distribuzione-e-dei-servizi-2019,Italy,it,2015
"UniCredit Joint declaration on “work-life balance”, 2017 - 2017",unicredit-joint-declaration-on-work-life-balance-2017,Italy,en,2017
ccnl-per-il-personale-dipendente-da-societ-e-consorzi-concessionari-di-autostrade-e-trafori-2016 - 2016,ccnl-per-il-personale-dipendente-da-societ-e-consorzi-concessionari-di-autostrade-e-trafori-2016,Italy,it,2016
ccnl per i dipendenti delle imprese di viaggi e turismo 2019-2020 - 2019,ccnl-per-i-dipendenti-delle-imprese-di-viaggi-e-turismo-2019-2020,Italy,it,2019
ccnl-per-i-dipendenti-dell-industria-cineaudiovisiva-2018-2021 - 2018,ccnl-per-i-dipendenti-dell-industria-cineaudiovisiva-2018-2021,Italy,it,2018
"ccnl logistica, trasporto merci e spedizione 2013-2015 - 2013",ccnl-logistica-trasporto-merci-e-spedizione-2013-2015,Italy,it,2013
"CONVENZIONE EUROPEA SU SALUTE E SICUREZZA DEL GRUPPO BARILLA, 2017 - 2017",convenzione-europea-su-salute-e-sicurezza-del-gruppo-barilla-2017,Italy,it,2017
"Generali promotes Telework: between Assicurazioni Generali S.p.A. and the European Works Council of the Generali Group, 2017 - 2017",generali-promotes-telework-between-assicurazioni-generali-s-p-a-and-the-european-works-council-of-the-generali-group-2017,Italy,en,2017
"ccnl dirigenti dipendenti dalle imprese creditizie, finanziarie e strumentali 2015 2018 - 2015",ccnl-dirigenti-dipendenti-dalle-imprese-creditizie-finanziarie-e-strumentali-2015-2018,Italy,it,2015
ccnl dipendenti imprese artigiane e delle piccole e medie imprese dell'area comunicazione 2016 2018.html - 2016,ccnl-dipendenti-imprese-artigiane-e-delle-piccole-e-medie-imprese-dell-area-comunicazione-2016-2018-html,Italy,it,2016
"ccnl Quadri direttivi e per il personale delle aree professionali dipendenti dalle imprese creditizie, finanziarie e strumentali 2015 2018 - 2015",ccnl-quadri-direttivi-e-per-il-personale-delle-aree-professionali-dipendenti-dalle-imprese-creditizie-finanziarie-e-strumentali-2015-2018,Italy,it,2015
ccnl università pontificie e facoltà ecclesiastiche 2017 2020 - 2017,ccnl-universit-pontificie-e-facolt-ecclesiastiche-2017-2020,Italy,it,2017
ccnl settore piccola e media industria legno mobili arredamento sughero forestale 2013 2016 - 2013,ccnl-settore-piccola-e-media-industria-legno-mobili-arredamento-sughero-forestale-2013-2016,Italy,it,2013
ccnl per i lavoratori addetti al servizio elettrico 2019 2021 - 2019,ccnl-per-i-lavoratori-addetti-al-servizio-elettrico-2019-2021,Italy,it,2019
"ccnl dipendenti delle aziende, società ed enti pubblici economici aderenti a federcasa 2016-2018 - 2016",ccnl-dipendenti-delle-aziende-societ-ed-enti-pubblici-economici-aderenti-a-federcasa-2016-2018,Italy,it,2016
ccnl impiegati amministrativi agenzie generali di generali Italia S.P.A 2018-2020 - 2018,ccnl-impiegati-amministrativi-agenzie-generali-di-generali-italia-s-p-a-2018-2020,Italy,it,2018
ccnl consorzi ed enti di sviluppo industriale 2019 - 2021 - 2019,ccnl-consorzi-ed-enti-di-sviluppo-industriale-2019---2021,Italy,it,2019
ccnl dipendenti avis 2010 - 2012 - 2010,ccnl-dipendenti-avis-2010---2012,Italy,it,2010
"ccnl personale anpas e realtà operanti ambito sociosanitario, assistenziale,educativo,delle pubbliche assistenze 2017 2019 - 2017",ccnl-personale-anpas-e-realt-operanti-ambito-sociosanitario-assistenziale-educativo-delle-pubbliche-assistenze-2017-2019,Italy,it,2017
ccnl personale fondazioni 2016 2018 - 2016,ccnl-personale-fondazioni-2016-2018,Italy,it,2016
ccnl personale impiegatizio e quadro agenzia demanio ente pubblico economico 2016 2018 - 2016,ccnl-personale-impiegatizio-e-quadro-agenzia-demanio-ente-pubblico-economico-2016-2018,Italy,it,2016
ccnl personale non dirigente coni servizi spa e federazioni sportive nazionali 2015 2017 - 2015,ccnl-personale-non-dirigente-coni-servizi-spa-e-federazioni-sportive-nazionali-2015-2017,Italy,it,2015
ccnl istituti e imprese vigilanza privata e servizi fiduciari assicurezza - 2013,ccnl-istituti-e-imprese-vigilanza-privata-e-servizi-fiduciari-assicurezza,Italy,it,2013
ccnl personale non dirigente poste italiane - 2017,ccnl-personale-non-dirigente-poste-italiane,Italy,it,2017
"ccnl industria della carta e cartone, cellulosa, pasta legno, fibra vulcanizzata, aziende cartotecniche e trasformatrici della carta 2017-2019 - 2017",ccnl-industria-della-carta-e-cartone-cellulosa-pasta-legno-fibra-vulcanizzata-aziende-cartotecniche-e-trasformatrici-della-carta-2017-2019,Italy,it,2017
"ccnl dipendenti imprese gestite e partecipate da enti locali,esercenti farmacie, parafarmacie, magazzini all'ingrosso e laboratori 2013-2015 - 2013",ccnl-dipendenti-imprese-gestite-e-partecipate-da-enti-locali-esercenti-farmacie-parafarmacie-magazzini-all-ingrosso-e-laboratori-2013-2015,Italy,it,2013
ccnl dipendenti da istituti e imprese di vigilanza privata e servizi fiduciari 2013-2015 - 2013,ccnl-dipendenti-da-istituti-e-imprese-di-vigilanza-privata-e-servizi-fiduciari-2013-2015,Italy,it,2013
ccnl dipendenti dai consorzi di bonifica e di miglioramento fondiario 2015-2018 - 2015,ccnl-dipendenti-dai-consorzi-di-bonifica-e-di-miglioramento-fondiario-2015-2018,Italy,it,2015
ccnl personale non direttivo e non dirigente del corpo nazionale dei vigili del fuoco 2016-2018 - 2016,ccnl-personale-non-direttivo-e-non-dirigente-del-corpo-nazionale-dei-vigili-del-fuoco-2016-2018,Italy,it,2016
"ccnl dipendenti da aziende dei settori pubblici esercizi, ristorazione collettiva e commerciale e turismo 2018-2021 - 2018",ccnl-dipendenti-da-aziende-dei-settori-pubblici-esercizi-ristorazione-collettiva-e-commerciale-e-turismo-2018-2021,Italy,it,2018
"ccnl dipendenti aziende esercenti produzione cemento, calce e suoi derivati, gesso e relativi manufatti 2016-2018 - 2016",-ccnl-dipendenti-aziende-esercenti-produzione-cemento-calce-e-suoi-derivati-gesso-e-relativi-manufatti-2016-2018-,Italy,it,2016
ccnl addetti all'industria dell'energia e del petrolio 2016-2018 - 2016,ccnl-addetti-all-industria-dell-energia-e-del-petrolio-2016-2018,Italy,it,2016
ccnl lavoratori dei porti 2016-2018 - 2016,ccnl-lavoratori-dei-porti-2016-2018,Italy,it,2016
"ccnl lavoratori cooperative esercenti attività settore taxi,radio taxi e settori strumentali e collaterali al trasporto pubblico locale non di linea 2015-2019 - 2015",ccnl-lavoratori-cooperative-esercenti-attivit-settore-taxi-radio-taxi-e-settori-strumentali-e-collaterali-al-trasporto-pubblico-locale-non-di-linea-2015-2019,Italy,it,2015
accordo collettivo nazionale collaboratori università non statali 2015-2016 - 2015,accordo-collettivo-nazionale-collaboratori-universit-non-statali-2015-2016,Italy,it,2015
ccnl rapporti di agenzia e rappresentanza commerciale comparto artigiano 2015-2017 - 2015,ccnl-rapporti-di-agenzia-e-rappresentanza-commerciale-comparto-artigiano-2015-2017,Italy,it,2015
ccnl agenzie di somministrazione di lavoro 2019-2021 - 2019,ccnl-agenzie-di-somministrazione-di-lavoro-2019-2021,Italy,it,2019
ccnl personale comparto sanità sezione ricerca sanitaria e attività supporto alla ricerca 2016-2018 - 2019,ccnl-personale-comparto-sanit-sezione-ricerca-sanitaria-e-attivit-supporto-alla-ricerca-2016-2018,Italy,it,2019
ccnl lavoratori dipendenti imprese attività agromeccaniche 2018-2020 - 2018,ccnl-lavoratori-dipendenti-imprese-attivit-agromeccaniche-2018-2020,Italy,it,2018
ccnl quadri e impiegati aziende gruppo INVITALIA 2017-2019 - 2017,ccnl-quadri-e-impiegati-aziende-gruppo-invitalia-2017-2019,Italy,it,2017
ccnl servizi ambientali 2016-2019 - 2016,ccnl-servizi-ambientali-2016-2019,Italy,it,2016
"accordo collettivo nazionale collaboratori enti di ricerca privati, istituto di ricovero a carattere scientifico 2016 - 2016",accordo-collettivo-nazionale-collaboratori-enti-di-ricerca-privati-istituto-di-ricovero-a-carattere-scientifico-2016,Italy,it,2016
"ccnl artisti, tecnici, amministrativi e ausiliari dipendenti da società cooperative e imprese sociali produzione culturale e spettacolo 2015-2018 - 2015",ccnl-artisti-tecnici-amministrativi-e-ausiliari-dipendenti-da-societ-cooperative-e-imprese-sociali-produzione-culturale-e-spettacolo-2015-2018,Italy,it,2015
ccnl dipendenti aziende videofonografiche 2014-2016 - 2014,ccnl-dipendenti-aziende-videofonografiche-2014-2016,Italy,it,2014
ccnl dipendenti da proprietari di fabbricati 2013-2014 - 2013,ccnl-dipendenti-da-proprietari-di-fabbricati-2013-2014,Italy,it,2013
cnnl personale dipendente agenzie marittime e raccomandatarie e mediatori marittimi 2018-2020,cnnl-personale-dipendente-agenzie-marittime-e-mediatori-marittimi-2018-2020,Italy,it,2018
ccnl personale del comparto sanità 2016-2018,ccnl-personale-del-comparto-sanit-2016-2018,Italy,it,2016
"ccnl testate periodiche di informazione locale, no profit e online, 2018-2020 - 2018",ccnl-testate-periodiche-di-informazione-locale-no-profit-e-online-2018-2020,Italy,it,2018
"ccnl quadri e impiegati agricoli, 2016-2019 - 2016",ccnl-quadri-e-impiegati-agricoli-2016-2019,Italy,it,2016
"ccnl settore gas e acqua, 2016-2018 - 2016",ccnl-settore-gas-e-acqua-2016-2018,Italy,it,2016
"ccnl personale dipendente settore assistenziale socio-sanitario e cure post intensive, 2017-2019 - 2017",ccnl-personale-dipendente-settore-assistenziale-socio-sanitario-e-cure-post-intensive-2017-2019,Italy,it,2017
"ccnl per gli operai agricoli e florovivaisti, 2018-2021 - 2018",ccnl-per-gli-operai-agricoli-e-florovivaisti-2018-2021,Italy,it,2018
"ccnl imbarcati sui natanti di cooperative di pesca, 2017-2020 - 2017",ccnl-imbarcati-sui-natanti-di-cooperative-di-pesca-2017-2020,Italy,it,2017
"ccnl dipendenti imprese artigiane di noleggio autobus con conducente e relative attività correlate, 2019-2020 - 2019",ccnl-dipendenti-imprese-artigiane-di-noleggio-autobus-con-conducente-e-relative-attivit-correlate-2019-2020,Italy,it,2019
"ccnl dipendenti degli istituti per il sostentamento del clero, 2017-2019 - 2017",ccnl-dipendenti-degli-istituti-per-il-sostentamento-del-clero-2017-2019,Italy,it,2017
"ccnl dipendenti dagli esercizi cinematografici e cinema-teatrali, 2017-2019 - 2017",ccnl-dipendenti-dagli-esercizi-cinematografici-e-cinema-teatrali-2017-2019,Italy,it,2017
"ccnl dipendenti aziende di lavorazione della foglia di tabacco secco allo stato sciolto, 2017-2020 - 2017",ccnl-dipendenti-aziende-di-lavorazione-della-foglia-di-tabacco-secco-allo-stato-sciolto-2017-2020,Italy,it,2017
"ccnl aziende esercenti lavorazione, commercio, trasporto, esportazione e importazione all'ingrosso di fiori freschi recisi, verde e piante ornamentali per imprese commerciali, consortili o cooperative e G.E.I.E. 2018 - 2016",ccnl-aziende-esercenti-lavorazione-commercio-trasporto-esportazione-e-importazione-all-ingrosso-di-fiori-freschi-recisi-verde-e-piante-ornamentali-per-imprese-commerciali-consortili-o-cooperative-e-g-e-i-e-2018,Italy,it,2016
